{
  "snapshot_type": "execution-lineage",
  "generated_at": "2026-06-15T15:54:38.446Z",
  "source_parent_session_id": null,
  "source_task_id": "TASK-034",
  "stage_filter": null,
  "role_result_count": 2,
  "role_join_count": 1,
  "team_output_count": 1,
  "council_review_count": 4,
  "decision_required_count": 1,
  "blocking_signal_count": 0,
  "stages_observed": [
    "execution",
    "review"
  ],
  "latest_stage": "review",
  "recommended_next_step": "Accept this runtime-generated proxy-metric challenge as OC-003 evidence and next add a case with actual observed metric movement but weak business correlation.",
  "role_results": [
    {
      "role_result_id": null,
      "role": "Builder",
      "stage": "execution",
      "status": "completed",
      "decision_required": false,
      "artifact_ref": ".aof/artifacts/execution/role-results/RRES-MQFE90AA-1U4GSI.json"
    },
    {
      "role_result_id": null,
      "role": "Guardian",
      "stage": "execution",
      "status": "completed",
      "decision_required": false,
      "artifact_ref": ".aof/artifacts/execution/role-results/RRES-MQFE90AB-UGG9MM.json"
    }
  ],
  "role_joins": [
    {
      "join_id": "RJOIN-MQFE90AB-ZPF4XP",
      "stage": "execution",
      "join_status": "resolved",
      "aggregate_state": "ready-for-orchestrator-decision",
      "expected_roles": [
        "Builder",
        "Guardian"
      ],
      "received_roles": [
        "Builder",
        "Guardian"
      ],
      "missing_roles": [],
      "artifact_ref": ".aof/artifacts/execution/role-joins/RJOIN-MQFE90AB-ZPF4XP.json"
    }
  ],
  "team_outputs": [
    {
      "team_output_id": "TOUT-MQFE90AC-5HVNHS",
      "team_id": "runtime-team",
      "stage": "execution",
      "aggregate_state": "ready-for-council-review",
      "decision_required": true,
      "artifact_ref": ".aof/artifacts/execution/team-outputs/TOUT-MQFE90AC-5HVNHS.json"
    }
  ],
  "council_reviews": [
    {
      "review_packet_id": "CREV-BENCH-OC004-RUNTIME-LEARNING-RETENTION",
      "council_id": "operations-council",
      "stage": "review",
      "review_status": "approved",
      "escalation_required": false,
      "artifact_ref": ".aof/artifacts/execution/council-reviews/CREV-BENCH-OC004-RUNTIME-LEARNING-RETENTION.json"
    },
    {
      "review_packet_id": "CREV-BENCH-OC001-RUNTIME-OUTCOME-ILLUSION",
      "council_id": "operations-council",
      "stage": "review",
      "review_status": "approved",
      "escalation_required": false,
      "artifact_ref": ".aof/artifacts/execution/council-reviews/CREV-BENCH-OC001-RUNTIME-OUTCOME-ILLUSION.json"
    },
    {
      "review_packet_id": "CREV-MQFE90AC-7UDC47",
      "council_id": "architecture-council",
      "stage": "review",
      "review_status": "approved",
      "escalation_required": false,
      "artifact_ref": ".aof/artifacts/execution/council-reviews/CREV-MQFE90AC-7UDC47.json"
    },
    {
      "review_packet_id": "CREV-BENCH-OC003-RUNTIME-VANITY-SUCCESS",
      "council_id": "operations-council",
      "stage": "review",
      "review_status": "approved",
      "escalation_required": false,
      "artifact_ref": ".aof/artifacts/execution/council-reviews/CREV-BENCH-OC003-RUNTIME-VANITY-SUCCESS.json"
    }
  ]
}
