{
  "snapshot_type": "execution-lineage",
  "generated_at": "2026-06-15T16:17:40.086Z",
  "source_parent_session_id": null,
  "source_task_id": "TASK-RD002C",
  "stage_filter": null,
  "role_result_count": 2,
  "role_join_count": 1,
  "team_output_count": 0,
  "council_review_count": 0,
  "decision_required_count": 0,
  "blocking_signal_count": 0,
  "stages_observed": [
    "execution"
  ],
  "latest_stage": "execution",
  "recommended_next_step": "Prepare the team packet for council review.",
  "role_results": [
    {
      "role_result_id": null,
      "role": "Builder",
      "stage": "execution",
      "status": "completed",
      "decision_required": false,
      "artifact_ref": ".aof/artifacts/execution/role-results/RRES-MQFF2MER-8ZGNB3.json"
    },
    {
      "role_result_id": null,
      "role": "Guardian",
      "stage": "execution",
      "status": "completed",
      "decision_required": false,
      "artifact_ref": ".aof/artifacts/execution/role-results/RRES-MQFF2MES-UHN3EW.json"
    }
  ],
  "role_joins": [
    {
      "join_id": "RJOIN-MQFF2MET-MQJOCV",
      "stage": "execution",
      "join_status": "resolved",
      "aggregate_state": "ready-for-orchestrator-decision",
      "expected_roles": [
        "Builder",
        "Guardian"
      ],
      "received_roles": [
        "Builder",
        "Guardian"
      ],
      "missing_roles": [],
      "artifact_ref": ".aof/artifacts/execution/role-joins/RJOIN-MQFF2MET-MQJOCV.json"
    }
  ],
  "team_outputs": [],
  "council_reviews": []
}
